,location,company_name,job_title,summary
239,London,TikTok,Accounts Payable Specialist,"Review and approve payment requests from global vendors on a daily basis.
Review the financial terms of global contracts.
Answer employees questions on AP."
240,London,Bausch Health,"Commercial Finance Manager (FP&A, Commercial Partnering",Supervise & develop 1 direct report and 1 non-direct report finance partner with respective responsibility for Vision Care portfolio and support function costs.
241,London,Sainsburys,Finance Manager (Capital),Develop strong relationships with divisional finance representatives and establish two way communication in order to effectively and proactively manage the…
242,London,HM Prison & Probation Service,Community Interventions Directorate Finance Officer,"Provide guidance to staff about Approved Premises finance procedures.
This role will assist in the accounting records and financial information in respect of a…"
243,London,Ambition,Revenue Assistant,"Dealing with fee earner & client queries.
Processing a high volume of bills.
You will be competent with IT systems such as Excel & Word."
244,London,Shawpoint,M&A/Corporate Finance VP,"O 6+ years of M&A/corporate finance experience, with a top-tier investment bank, boutique or M&A/Transaction Services team within a Big 4 accountancy firm."
245,London,Watches2U,Finance Manager,UK based £10m+ multinational ecommerce business seeking a qualified Financial Accountant to manage all the financial and accounting activities of the business.
246,Docklands,TikTok,Accounts Payable Specialist,"Review and approve payment requests from global vendors on a daily basis.
Review the financial terms of global contracts.
Answer employees questions on AP."
247,London,Tradeweb,Financial Accountant,"Working with the finance operations team to ensure correct cash application.
Provide assistance in various finance projects which drive automation and…"
248,London,Millennium Management,Accounts Payable Specialist,"Additionally the candidate will support local accountants with month end finance activities as required (fixed assets, banks recs, intercompany, accruals &…"
249,London,The Harrington Collection,Finance Manager,"The candidate must be technically astute and fully qualified ACA or ACCA.
Fully qualified ACA or ACCA qualification is necessary.
Able to grow with the company."
250,London,Capita Plc,Actuarial Analyst,Capita are looking for an Actuarial Analyst to provide technical analysis and support for the actuarial function.
251,South London,Intercontinental Exchange,Counterparty AML Analyst,Review AML/KYC Due Diligence on a range of counterparties with different legal structures and in various jurisdictions.
252,Harrow on the Hill,Vanet Asset Management,Accounts Manager,"Collect/check & sign-off invoices for authorisation/payment by finance.
Our employees are meticulous, highly professional and well-trained, with a thorough…"
253,London,CITI,"ICG Risk & Control, Non-Financial Risk Lead, MD","This new role is part of ICG Risk & Control Leadership Team, working with ICG Business partners and Second Line functions to support the Head of ICG Risk &…"
254,London,Shawpoint,M&A/Corporate Finance VP,"O 6+ years of M&A/corporate finance experience, with a top-tier investment bank, boutique or M&A/Transaction Services team within a Big 4 accountancy firm."
255,Shepperton,Watches2U,Finance Manager,UK based £10m+ multinational ecommerce business seeking a qualified Financial Accountant to manage all the financial and accounting activities of the business.
256,London,TikTok,Accounts Payable Specialist,"Review and approve payment requests from global vendors on a daily basis.
Review the financial terms of global contracts.
Answer employees questions on AP."
257,London EC2A 4FT,Tradeweb,Financial Accountant,"Working with the finance operations team to ensure correct cash application.
Provide assistance in various finance projects which drive automation and…"
258,London EC4A 2BB,Millennium Management,Accounts Payable Specialist,"Additionally the candidate will support local accountants with month end finance activities as required (fixed assets, banks recs, intercompany, accruals &…"
259,London,The Harrington Collection,Finance Manager,"The candidate must be technically astute and fully qualified ACA or ACCA.
Fully qualified ACA or ACCA qualification is necessary.
Able to grow with the company."
260,London,Colt Technology Services,Finance Manager,"Provide operational finance support to DCS Management Team and key business stakeholders.
Lead the development and implementation of finance process, policies…"
261,London EC2A,Thamesmead School,Senior Finance Officer,Thamesmead School is seeking to appoint a Senior Finance Officer who is accountancy qualified and experienced in the maintenance of Company Accounts.
262,London,Ampersand Consulting,Accounts Payable Assistant,"The team are experienced and will suit an outgoing individual with a real passion for finance.
Overseeing and assisting with complex vendor, payment and invoice…"
263,London EC3R,Close Brothers Group,Senior PMO Analyst,The PMO Analyst will work across Premium Finance Technology & Change to support the delivery of a complex portfolio of work within the Business Line portfolio.
264,London SE1 4YB,Women in Sport,Finance Officer (Fixed term 6-8 months),"Update and run the monthly management account and cost centre templates, liaising with budget holders to resolve queries."
265,London SE1,Institutional Shareholder Services Inc,Junior Sales – Sustainable Finance Solutions,Partner with senior sales executives to hand off qualified leads and facilitate continued development of opportunities: prepare meetings with potential clients…
266,London,Carneys Community,Finance Officer,"; Dealing with supplier and staff queries and producing ad hoc reports as required;
; Ensuring all income and expenditure transactions are accurately recorded…"
267,London,Page Personnel - UK,Charity Finance Assistant,"Preparing invoices, including grant claims.
Banking of cheques & cash as required.
Processing BACS and cheque payments.
Controlling debit card & petty cash."
268,London,Greenwich Partners,"Trainee equity research analyst, European Pharmaceuticals, major bank",The role will work with one of the most successful teams and work with the senior analysts on writing equity research for their hedge funds and asset management…
269,London,Stanton House,Finance Data Analyst - R2R,A global business are looking for a highly proficient Finance Business Analyst to come in and support the R2R workstream.
270,London,The JM Group,Finance Analyst - Reconciliations,"The ideal Reconciliation Analyst will be responsible for reconciling the data between two systems.
Need to make sure the balances reconcile and they are the…"
271,London,Morgan McKinley,"Finance Specialist (2-3 days / week, Permanent)","Working in a small, closely-knitted team, you will help the management team to analyze profits and costs, and forecast yearly and monthly results."
272,London,Page Personnel - UK,Part Time Finance Assistant - Consultancy Brand,"Once payment run has been approved, mark invoices that have been paid and file.
Prepare bank payment on-line as indicated ready for approval."
273,London,Aston Charles,Junior/ Trainee Financial Adviser - London,"Ongoing mentoring – hands on support to ensure long-term success.
Marketing support – providing a regular, sustained flow of new clients and business…"
274,Orpington,London South East Colleges,Graduate Finance Trainee,"To be successful in this role, you'll need to have excellent interpersonal, communication and numeracy skills."
275,London E14 4AD,Morgan Stanley,Investment Data Analytics Apprentice International Equity Investment Team,"The team follows a disciplined investment process, selecting stocks based on detailed fundamental analysis.
Understanding the data needs of the team and using…"
276,London,Marks Sattin Specialist Recruitment,Accounts Assistant,"Support the communication of queries between the firm and the Corporate Team.
This role is perfect for someone who is looking for a long term, stable role and…"
277,London,Universal Business Team,Accounts Assistant,"The company is operationally excellent and enjoys great customer loyalty.
You will be responsible for performing daily accounting tasks that will support the…"
278,London,Citadel Enterprise Europe Limited,Associate,The Associate will conduct analysis of European stocks and make investment recommendations and decisions based upon his/her independent research and analysis.
279,London,Bank of England,"Team Member - Banking, Payments & Innovation Directorate","The variety and immediacy of the work we do means we are one of the most outward facing and fast moving areas of the Bank, operating the UK's high value…"
280,London,Harrington-Leigh,Trainee Mortgage & Protection Advisor - REMOTE WORKING,We are looking to take on Individuals with no previous experience in financial services and help train them become qualified advisers in protection (life…
281,London,Finixio,Finance Assistant,"Raising sales invoice and producing weekly debtors report.
Posting purchase invoices; ensuring they are approved and paid during pay runs."
282,London E14 5JP,JP Morgan Chase,CIB – Investment Banking – Acquisition & Leveraged Finance – Analyst - London,"Our professionals take the long view of each client’s needs and assess the best ways for them to execute their strategy.
Building and using financial models."
283,London SE1,Social Finance Limited,Analyst,"The Social Finance Analyst Programme is open to all applicants who have a university degree or equivalent professional experience, working in research, analysis…"
284,London,Bluebox Corporate Finance,Corporate Finance Analyst,"The successful applicant will have the desire to work in Corporate Finance and ultimately study for the CFA.
Attending potential client pitches, taking minutes,…"
285,Bloomsbury,British Museum,Finance Officer: Payables,"We are looking for candidates who are part qualified and working towards, or have obtained, an accounting qualification (e.g. ACCA/ACA/CIMA) with a high level…"
286,Holborn,Tempo,Accounts Assistant,"Your role will include taking ownership of bank reconciliations, managing the upload of invoices into Xero, managing external vendors by providing remittances…"
287,London EC4A 2BB,Goldman Sachs,"Executive Office, Government Affairs, Analyst, London","Monitoring political, policy and regulatory developments which may impact the firm or key clients.
Preparing briefings and presentations for internal…"
288,London,KennedyPearce Consulting,Payroll and Finance Assistant,"Dealing with internal staff payroll queries.
Payroll (70%) and Finance Assistant (30%) position available for a candidate on a short term notice."
289,London,Page Personnel - UK,Part Time Finance Assistant - Consultancy Brand,"Once payment run has been approved, mark invoices that have been paid and file.
Prepare bank payment on-line as indicated ready for approval."
290,London,Page Personnel - UK,Band 6 NHS Finance Analyst,"The Band 6 NHS Finance Analyst role requires the candidate to:
Produce annual income and expenditure base budget schedules for each sub division/department…"
291,London,Page Personnel - UK,Charity Finance Assistant,"Preparing invoices, including grant claims.
Banking of cheques & cash as required.
Processing BACS and cheque payments.
Controlling debit card & petty cash."
292,London,Aston Charles,Junior/ Trainee Financial Adviser - London,"Ongoing mentoring – hands on support to ensure long-term success.
Marketing support – providing a regular, sustained flow of new clients and business…"
293,London,Inspiring Interns,Finance Assistant,"Their extensive portfolio covers educational travel for schools, colleges and universities, English language schools for adult and junior students in the UK,…"
294,London,Shawpoint,M&A/Corporate Finance VP,"Candidates will benefit from a lean team with ample opportunity to focus on the mid-market for progression and client exposure.
O Term sheet and legal mark-ups."
295,Shepperton,Tradeweb,Financial Accountant,"Recently qualified accountant/Finalist (ACA, ACCA, CIMA) , with previous relevant experience.
You will be a self-starter with excellent analytical skills."
296,London NW1 7HA,TikTok,Accounts Payable Specialist,"Review and approve payment requests from global vendors on a daily basis.
Review the financial terms of global contracts.
Answer employees questions on AP."
297,London,Watches2U,Finance Manager,UK based £10m+ multinational ecommerce business seeking a qualified Financial Accountant to manage all the financial and accounting activities of the business.
298,South London,Millennium Management,Accounts Payable Specialist,The successful candidate will have a reasonable understanding of the Procure to Pay process from working with a recognized accounting platform (Oracle Cloud…
299,London,experisuk,Finance Director,"Fully qualified accountant, ideally from a Big4 background.
This role supports the Engineering teams and is responsible for partnering with and providing all…"
300,London,RBC,RBC Capital Markets RLaunch Program 2020,"Candidates join as full-time, permanent employees with the option to rotate.
The program complements our existing efforts to increase diverse talent in senior…"
301,London,Thamesmead School,Senior Finance Officer,Thamesmead School is seeking to appoint a Senior Finance Officer who is accountancy qualified and experienced in the maintenance of Company Accounts.
302,London,HM Prison & Probation Service,Community Interventions Directorate Finance Officer,This role will assist in the accounting records and financial information in respect of a cluster of Approved Premises within a Division.
303,London,The Collective,Finance Assistant,"Helping production of statutory accounts and answering any audit queries.
Assisting with any HQ department queries.
Reconciling intercompany on a weekly basis."
304,London,Shawpoint,M&A/Corporate Finance VP,"O 6+ years of M&A/corporate finance experience, with a top-tier investment bank, boutique or M&A/Transaction Services team within a Big 4 accountancy firm."
305,London,Tradeweb,Financial Accountant,"Working with the finance operations team to ensure correct cash application.
Provide assistance in various finance projects which drive automation and…"
306,London,TikTok,Accounts Payable Specialist,"Review and approve payment requests from global vendors on a daily basis.
Review the financial terms of global contracts.
Answer employees questions on AP."
307,London,Watches2U,Finance Manager,UK based £10m+ multinational ecommerce business seeking a qualified Financial Accountant to manage all the financial and accounting activities of the business.
308,London E14 5JP,Millennium Management,Accounts Payable Specialist,"Additionally the candidate will support local accountants with month end finance activities as required (fixed assets, banks recs, intercompany, accruals &…"
309,London,experisuk,Finance Director,"Influencing and leading a multitude of stakeholders in the business and finance.
Fully qualified accountant, ideally from a Big4 background."
310,London EC2A,CA CIB UK,Internship 12 month placement – Counterparty Risk Analyst Intern,"Maintain appropriate knowledge to ensure to be fully qualified to undertake the role.
Types of Jobs - Corporate & Investment Banking."
311,London,Eat Work Art,Junior Accounts Assistant,"= Investigate and resolve supplier and resident finance queries.
= Sort and file relevant paperwork and undertake other ad hoc finance duties."
312,London,Clocktower Group,Investment Associate,"Our UK-based Investment Associate will work hand in glove with the Venture Partner who runs our European practice, taking part in all aspects of our European…"
313,London,Harrington-Leigh,Trainee Mortgage & Protection Advisor - REMOTE WORKING,We are looking to take on Individuals with no previous experience in financial services and help train them become qualified advisers in protection (life…
314,London,Ryder Reid Legal,Banking Paralegal,"The role will be busy and varied and duties in this paralegal role may include; drafting and preparing corporate documents/materials, working closely with…"
315,London,Ambition,Revenue Assistant,"Dealing with fee earner & client queries.
Processing a high volume of bills.
You will be competent with IT systems such as Excel & Word."
316,London,KennedyPearce Consulting,Finance Assistant,"Respond to queries and issues arising in a timely and professional manner.
As a business they manage lifestyle, investment portfolio and assets of high net…"
317,London,Octavius Finance,Global Equity Analyst (Intern Position) – Market Neutral Long Short Fund,"Working closely with PM’s and the CIO to screen investment ideas.
Updating, creating and building on new and existing valuation models."
318,East London,Inspiring Interns,Finance Assistant,"You will be hands on, enthusiastic, passionate, ambitious and full of drive.
Professional development – budget plus time (5 days!) to spend on whatever helps…"
319,London,Page Personnel - UK,Band 6 NHS Finance Analyst,Provide training and advice to budget holders and other finance colleagues regarding financial management issues arising out of variance and other ad hoc…
320,London,Cedar Recruitment Limited,Finance Business Partner,"Production of finance packs with commentary.
The ideal candidate for the role of Finance Business Partner will be a qualified accountant (ACA / CIMA / ACCA) who…"
321,London,Media Contacts Ltd,Financial Analyst – Entry level,"A degree from a first-class university in business, finance or accounting.
A high growth start-up providing business critical intelligence to banks and law…"
322,London,Marks Sattin Specialist Recruitment,Accounts Assistant,"Support the communication of queries between the firm and the Corporate Team.
This role is perfect for someone who is looking for a long term, stable role and…"
323,London,Inspiring Interns,Finance Administrator Intern,"The position primarily supports all Finance and Accounting tasks in the London Office.
The role is to assist the UK Finance team with general accounting,…"
324,London,Citadel Enterprise Europe Limited,Associate,The Associate will conduct analysis of European stocks and make investment recommendations and decisions based upon his/her independent research and analysis.
325,London,Aston Charles,Junior/ Trainee Financial Adviser - Reading,"Ongoing mentoring – hands on support to ensure long-term success.
Marketing support – providing a regular, sustained flow of new clients and business…"
326,London,Universal Business Team,Accounts Assistant,"The company is operationally excellent and enjoys great customer loyalty.
You will be responsible for performing daily accounting tasks that will support the…"
327,London,Tiger Recruitment Ltd,Junior Assistant - Investment Banking,"This is role is suited for someone eager to grow and expand their knowledge of banking.
It is a Junior role, therefore, are looking for someone flexible and…"
328,London,Law Choice Recruitment,Junior Finance Administrator,Are you a recent School or College leaver with a passion or Maths? Or are you keen to get into Legal Finance? This could be the start of something special!…
329,London,Capital Index,Junior KYC and On-boarding Analyst,"Be available to support regular seminars offered by Partner companies and assist with account opening queries via chat, telephone and email."
330,London EC4M 7AW,Tradeweb,Financial Accountant,"Recently qualified accountant/Finalist (ACA, ACCA, CIMA) , with previous relevant experience.
You will be a self-starter with excellent analytical skills."
331,London,TikTok,Accounts Payable Specialist,"Review and approve payment requests from global vendors on a daily basis.
Review the financial terms of global contracts.
Answer employees questions on AP."
332,Waltham Forest,Watches2U,Finance Manager,UK based £10m+ multinational ecommerce business seeking a qualified Financial Accountant to manage all the financial and accounting activities of the business.
333,London WC1V 6NX,Millennium Management,Accounts Payable Specialist,The successful candidate will have a reasonable understanding of the Procure to Pay process from working with a recognized accounting platform (Oracle Cloud…
334,London E4,Shawpoint,M&A/Corporate Finance VP,"Candidates will benefit from a lean team with ample opportunity to focus on the mid-market for progression and client exposure.
O Term sheet and legal mark-ups."
335,London,Northern Trust Corp.,JUNIOR BUSINESS PROCESS ANALYST – ASSET MANAGEMENT,"Reporting to the Head of Business Governance & Operational Oversight the candidate will be responsible for providing administrative, logistical and project…"
336,London,Encompass Corporation,Financial Controller,"Encompass are looking for an interim Financial Controller to join us in either Glasgow or London on a FTC of 12 months, to lead and manage the finance function."
337,Croydon,Third Bridge,Research Analyst,"To make the right investment decisions, our clients require access to the most relevant experts and their insights – we enable this through private…"
338,London NW1 7HA,Colbern Limited,Finance Officer,"Our client is looking for an experienced Local Authority Finance Officer –.
To provide a business focussed, strategic financial advisory and support service to…"
339,London,KennedyPearce Consulting,Payroll and Finance Assistant,"Dealing with internal staff payroll queries.
Payroll (70%) and Finance Assistant (30%) position available for a candidate on a short term notice."
340,London,Finixio,Finance Assistant,"Raising sales invoice and producing weekly debtors report.
Posting purchase invoices; ensuring they are approved and paid during pay runs."
341,London,Bluebox Corporate Finance,Corporate Finance Analyst,"The successful applicant will have the desire to work in Corporate Finance and ultimately study for the CFA.
Attending potential client pitches, taking minutes,…"
342,London EC4A 2BB,Goldman Sachs,"Executive Office, Government Affairs, Analyst, London","Monitoring political, policy and regulatory developments which may impact the firm or key clients.
Preparing briefings and presentations for internal…"
343,London,Page Personnel - UK,Part Time Finance Assistant - Consultancy Brand,"Once payment run has been approved, mark invoices that have been paid and file.
Prepare bank payment on-line as indicated ready for approval."
344,London,Page Personnel - UK,Charity Finance Assistant,"Preparing invoices, including grant claims.
Banking of cheques & cash as required.
Processing BACS and cheque payments.
Controlling debit card & petty cash."
345,London,Page Personnel - UK,Band 6 NHS Finance Analyst,"The Band 6 NHS Finance Analyst role requires the candidate to:
Produce annual income and expenditure base budget schedules for each sub division/department…"
346,London,The JM Group,Finance Analyst - Reconciliations,"The ideal Reconciliation Analyst will be responsible for reconciling the data between two systems.
Need to make sure the balances reconcile and they are the…"
347,London,Inspiring Interns,Finance Administrator Intern,"The position primarily supports all Finance and Accounting tasks in the London Office.
The role is to assist the UK Finance team with general accounting,…"
348,London,Page Personnel - UK,Graduate finance analyst,"The client is a regulatory body based in London.
Support the development, maintenance and use of financial models to best practice standards."
349,London,Aston Charles,Junior/ Trainee Financial Adviser - London,"Ongoing mentoring – hands on support to ensure long-term success.
Marketing support – providing a regular, sustained flow of new clients and business…"
350,East London,Inspiring Interns,Finance Assistant,"You will be hands on, enthusiastic, passionate, ambitious and full of drive.
Professional development – budget plus time (5 days!) to spend on whatever helps…"
351,London,Law Choice Recruitment,Junior Finance Administrator,Are you a recent School or College leaver with a passion or Maths? Or are you keen to get into Legal Finance? This could be the start of something special!…
352,London E14 4AD,Morgan Stanley,Investment Data Analytics Apprentice International Equity Investment Team,"The team follows a disciplined investment process, selecting stocks based on detailed fundamental analysis.
Understanding the data needs of the team and using…"
353,London,Marks Sattin Specialist Recruitment,Accounts Assistant,"Support the communication of queries between the firm and the Corporate Team.
This role is perfect for someone who is looking for a long term, stable role and…"
354,London,Vodafone,Commercial Finance Analyst,Leading the S15 accounting/reporting for the indirect channels and owning the indirect assumption into the UK’s channel profitability programme to better…
355,London,Bank of America,"Analyst, Investment Banking","Actively contribute to the preparation of client presentations and underlying financial analysis.
Work closely with clients, lawyers and representatives from…"
356,London,Finixio,Finance Assistant,"Raising sales invoice and producing weekly debtors report.
Posting purchase invoices; ensuring they are approved and paid during pay runs."
357,Holborn,Tempo,Accounts Assistant,"Your role will include taking ownership of bank reconciliations, managing the upload of invoices into Xero, managing external vendors by providing remittances…"
358,London EC4A 2BB,Goldman Sachs,"Executive Office, Government Affairs, Analyst, London","Monitoring political, policy and regulatory developments which may impact the firm or key clients.
Preparing briefings and presentations for internal…"
