,location,company_name,job_title,summary
0,London,Capital Index,Junior KYC and On-boarding Analyst,"Be available to support regular seminars offered by Partner companies and assist with account opening queries via chat, telephone and email."
1,London,Cognithan Limited,Accounts Assistant,"Respond to and resolve all accounting and payroll queries and enquiries.
Work with the Accountant to prepare unit budgets, monitor and report on units financial…"
2,London SE1 2QH,Lewisham Council,Finance and Admin Officer,"Job type: full-time 35 hours.
To provide Finance Support through raising Purchase Orders, process invoices/ bills, setting up new suppliers and handle related…"
3,London,"UK Government - Department for Business, Energy &...",International Climate Finance Communications and Engagement Officer,This will entail effectively responding to briefing requests and providing strategic communications contributions in support of ICF policy development and…
4,London E14 5JP,Raynet Recruitment Ltd,Finance Officer,"Contribute to the implementation of the fairer contributions policy,the assessment and collection of client contribtions and the reduction of debt."
5,London,Nucleus Central,Assistant Finance Project Analyst,"Working within the Finance department, you will be responsible for supporting the Finance Project Analyst team to ensure that the company is achieving project…"
6,London,JP Morgan Chase,CIB – Investment Banking – Acquisition & Leveraged Finance – Analyst - London,"Our professionals take the long view of each client’s needs and assess the best ways for them to execute their strategy.
Building and using financial models."
7,London,Leyton UK Limited,Finance Administrator,"The ultimate aim of this role is to support our Finance team in client satisfaction and managing client payments.
Achieving targets set for cash collection."
8,London,BNP Paribas,London - Graduate Analyst Programme 2020 - Trading,"The Group helps them realise their personal and professional projects through solutions spanning financing, investment, savings and insurance."
9,London,Munich Re Speciality Group Ltd,Accounts Payable Clerk,"The role will suit an partly-qualified accountant who is looking to work in an ethical and driven work environment.
Prepare, process and record payment runs,."
10,Holborn,Tempo,Accounts Assistant,"Your role will include taking ownership of bank reconciliations, managing the upload of invoices into Xero, managing external vendors by providing remittances…"
11,London,The British Museum,Finance Officer: Payables (mat cover),"We are looking for candidates who are part qualified and working towards, or have obtained, an accounting qualification (e.g. ACCA/ACA/CIMA) with a high level…"
12,London,Sainsburys,Finance Manager (Capital),"A key member of the wider Retail FP&A team with primary responsibility for the monitoring, control, planning, budgeting, forecasting and reporting of capital…"
13,London,Post Office Ltd,Junior OE Analyst x 2,"Contract Type: Fixed Term Contract - 3 Months.
The analyst will work side by side with two additional established OE Analysts and liaise directly with managers…"
14,London,BNP Paribas,London - Graduate Analyst Programme 2020 - Trading,"The Group helps them realise their personal and professional projects through solutions spanning financing, investment, savings and insurance."
15,London RM8,EMS Events,Financial Controller,"Love numbers, to see patterns and review data for statistical analysis, spot trends, losses, gains and spending patterns.
Job Types: Full-time, Permanent."
16,London,Bank of England,"Team Member - Banking, Payments & Innovation Directorate","The variety and immediacy of the work we do means we are one of the most outward facing and fast moving areas of the Bank, operating the UK's high value…"
17,London,Finixio,Finance Assistant,"Raising sales invoice and producing weekly debtors report.
Posting purchase invoices; ensuring they are approved and paid during pay runs."
18,London,sync.money,Data Analyst,"English speaking, with multiple languages beneficial.
Hardworking, willing to take responsibility but also a co-worker.
Experience in data visualisation tools."
19,London,Sainsburys,Finance Analyst (Capital),"Our colleagues get the support to grow into the leaders of the future, with structured development and excellent progression opportunities across the Group."
20,London N11 1GN,Walsingham Support,Finance Assistant,"To respond to email and telephone queries within a timely manner.
To ensure in conjunction with the other Finance Assistants that the finance function of the…"
21,London SE1 4YB,Women in Sport,Finance Officer (Fixed term 6-8 months),"Update and run the monthly management account and cost centre templates, liaising with budget holders to resolve queries."
22,London EC4A 2BB,Goldman Sachs,"Executive Office, Government Affairs, Analyst, London","Monitoring political, policy and regulatory developments which may impact the firm or key clients.
Preparing briefings and presentations for internal…"
23,London E1 6JE,Lendable,Graduate Analyst,Our relentless drive to automate and improve processes allows customers to apply for and receive their loan in well under 10 minutes on average (instead of days…
24,London,Scotiabank,"Analyst, Global Capital Markets Rotational Programme","For individuals who are passionate about the capital markets, this program is designed to develop technical, analytical and interpersonal skills in the sales,…"
25,London,Inspiring Interns,Operations/ Finance Assistant,"By bridging the gap between creative and web development, they work together with internal teams to architect, deliver, test and maintain reliable, scalable…"
26,London,Page Personnel - UK,Graduate finance analyst,"The client is a regulatory body based in London.
Support the development, maintenance and use of financial models to best practice standards."
27,East London,Inspiring Interns,Finance Assistant,"You will be hands on, enthusiastic, passionate, ambitious and full of drive.
Professional development – budget plus time (5 days!) to spend on whatever helps…"
28,London,Aston Charles,Junior/ Trainee Financial Adviser - London,"Ongoing mentoring – hands on support to ensure long-term success.
Marketing support – providing a regular, sustained flow of new clients and business…"
29,London,Law Choice Recruitment,Junior Finance Administrator,Are you a recent School or College leaver with a passion or Maths? Or are you keen to get into Legal Finance? This could be the start of something special!…
30,London E14 4AD,Morgan Stanley,Investment Data Analytics Apprentice International Equity Investment Team,"An interest in investing and finance.
The team follows a disciplined investment process, selecting stocks based on detailed fundamental analysis."
31,London,Marks Sattin Specialist Recruitment,Accounts Assistant,"Support the communication of queries between the firm and the Corporate Team.
This role is perfect for someone who is looking for a long term, stable role and…"
32,London,Page Personnel - UK,Graduate finance analyst,"The client is a regulatory body based in London.
Support the development, maintenance and use of financial models to best practice standards."
33,London,Cedar Recruitment Limited,Finance Business Partner,"Production of finance packs with commentary.
The ideal candidate for the role of Finance Business Partner will be a qualified accountant (ACA / CIMA / ACCA) who…"
34,London,Law Choice Recruitment,Junior Finance Administrator,Are you a recent School or College leaver with a passion or Maths? Or are you keen to get into Legal Finance? This could be the start of something special!…
35,London,Aston Charles,Junior/ Trainee Financial Adviser - Reading,"Ongoing mentoring – hands on support to ensure long-term success.
Marketing support – providing a regular, sustained flow of new clients and business…"
36,London,Media Contacts Ltd,Financial Analyst – Entry level,"A degree from a first-class university in business, finance or accounting.
A high growth start-up providing business critical intelligence to banks and law…"
37,London,Law Choice Recruitment,Finance Assistant,"If you have experience within professional services, an understanding of Billing/Accounts within Legal would also be great, and you’re looking for a role to…"
38,London,Law Choice Recruitment,LEGAL CASHIER/FINANCE ASSISTANT,This impressive growing law firm based close to Bank is currently looking for a Legal Cashier to join its friendly and growing Accounts team. This is a real…
39,London,CMC Consulting Ltd,Leveraged Finance Specialists,Building and reviewing financial models for assessing the viability of transaction structures and determining appropriate debt levels.
40,London,Bramwith Consulting,MULTIPLE ROLES** - PROCUREMENT - BUYER'S,"A diverse role, gaining exposure to a wide array of Indirect spend areas including, HR, Marketing, IT, Professional Services and FM."
41,Waltham Forest,Colbern Limited,Finance Officer,"Our client is looking for an experienced Local Authority Finance Officer –.
To provide a business focussed, strategic financial advisory and support service to…"
42,London,Oliver James Associates,"Finance Analyst - £55,000","A qualified accountant, (ACA/CIMA/CFA/ACCA).
A leading insurance business is looking for a commercially minded financial analyst to join its high performance…"
43,London,Harcourt Matthews,Finance Project Manager – Billing Change Transformation Programme,"As a 2:1/1st class graduate PRINCE 2, PMP or APM qualified individual with significant finance projects experience covering Billings and IT systems…"
44,London,Radley Green,Finance Director - tech,Private Equity backed Start-up Sports Analytics business currently recruiting a Finance Director for their London based Head office.
45,London,Sheridan Maine,Finance Analyst/Accountant,"Technically strong ACA/ACCA/CIMA/CA qualified candidate from an audit background.
As Finance Analyst, you will be part of a small team responsible for the…"
46,London,Aston Charles,Junior/ Trainee Financial Adviser - London,"Ongoing mentoring – hands on support to ensure long-term success.
Marketing support – providing a regular, sustained flow of new clients and business…"
47,Orpington,London South East Colleges,Graduate Finance Trainee,"To be successful in this role, you'll need to have excellent interpersonal, communication and numeracy skills."
48,London,International Audit Connections,ESG and Sustainable Finance Consultancy Opportunities,"Sustainable finance reporting and assurance.
Portfolio ESG risk assessment, due diligence and modelling.
Responsible investment and lending strategy."
49,London,KennedyPearce Consulting,Finance IT Specialist- Oracle,"Understand and use the models built in finance.
Degree educated with finance/business/computing orientation a plus.
Managing and maintaining system integrity."
50,London,KennedyPearce Consulting,Finance Assistant,"Respond to queries and issues arising in a timely and professional manner.
As a business they manage lifestyle, investment portfolio and assets of high net…"
51,London,Ambition,Revenue Assistant,"Dealing with fee earner & client queries.
Processing a high volume of bills.
You will be competent with IT systems such as Excel & Word."
52,London,Page Personnel - UK,Band 6 NHS Finance Analyst,Provide training and advice to budget holders and other finance colleagues regarding financial management issues arising out of variance and other ad hoc…
53,London,Inspiring Interns,Finance Administrator Intern,"The position primarily supports all Finance and Accounting tasks in the London Office.
The role is to assist the UK Finance team with general accounting,…"
54,London,Shawpoint,M&A/Corporate Finance VP,"O 6+ years of M&A/corporate finance experience, with a top-tier investment bank, boutique or M&A/Transaction Services team within a Big 4 accountancy firm."
55,London,Capital Index,Junior KYC and On-boarding Analyst,"Be available to support regular seminars offered by Partner companies and assist with account opening queries via chat, telephone and email."
56,London E14,Tradeweb,Financial Accountant,"Working with the finance operations team to ensure correct cash application.
Provide assistance in various finance projects which drive automation and…"
57,London,Millennium Management,Accounts Payable Specialist,"Additionally the candidate will support local accountants with month end finance activities as required (fixed assets, banks recs, intercompany, accruals &…"
58,London E1 8PR,Hughes Electronics Ltd,Accounts & Finance Manager,"Hughes Electronics are a small friendly business to business enterprise supplying own brand of cables, connectors and passive networking products to the…"
59,Woking,TikTok,Accounts Payable Specialist,"Review and approve payment requests from global vendors on a daily basis.
Review the financial terms of global contracts.
Answer employees questions on AP."
60,London N11 1GN,ELIGIBLE,Data Analyst,We are looking for an individual to work as a Data Analysts to service and support the wider business with analytical insights and support the execution of key…
61,London NW1,European Bank for Reconstruction and Development,Analyst,"The Analyst contributes to all phases of the project cycle, including project origination, structuring, execution, implementation and monitoring."
62,London,Barts Health NHS Trust,Head of Finance,"To succeed, you’ll be a qualified accountant with strong financial management and finance policies experience, gained within an NHS environment."
63,London,Asahi International,Finance Graduate,"Superior numeracy skills, problem solving, excellent attention to detail and analytical skills with good excel experience.
Job Types: Full-time, Permanent."
64,London,Shawpoint,M&A/Corporate Finance VP,"O 6+ years of M&A/corporate finance experience, with a top-tier investment bank, boutique or M&A/Transaction Services team within a Big 4 accountancy firm."
65,East London,Capital Index,Junior KYC and On-boarding Analyst,"Be available to support regular seminars offered by Partner companies and assist with account opening queries via chat, telephone and email."
66,London,Tradeweb,Financial Accountant,"Working with the finance operations team to ensure correct cash application.
Provide assistance in various finance projects which drive automation and…"
67,London,Millennium Management,Accounts Payable Specialist,"Additionally the candidate will support local accountants with month end finance activities as required (fixed assets, banks recs, intercompany, accruals &…"
68,London,Harrington-Leigh,Trainee Mortgage & Protection Advisor - REMOTE WORKING,We are looking to take on Individuals with no previous experience in financial services and help train them become qualified advisers in protection (life…
69,Greater London,HM Courts and Tribunals Service,Corporate Reporting Finance Support,"You will work with finance business partners, HQ finance and operational colleagues to ensure that key spending trends are identified and any budget variances…"
70,London SE1,Vodafone,Commercial Finance Manager,"Own and manage the relationships into the functional business units such as BI, FP&A and finance Transformation, and out towards the Segments, where pricing and…"
71,London EC2V 6DL,Fjord Management Limited,Financial Accountant,"ACA / ACCA / CIMA qualified with some PQE experience.
We are working with a construction and engineering company with a turnover of c.£800M to hire a Financial…"
72,Camden,Boston Hale,Interim Senior Finance Officer,"The main purpose of the position is to manage the payables function and ensure suppliers and staff are paid in a timely manner.
Lead a team of Finance Officers."
73,London,Motorola Solutions,SSA/UN Finance Controller,"Support regional tax, treasury, accounting and other support finance teams on compliance and various corporate finance matters."
74,Orpington,London South East Colleges,Graduate Finance Trainee,"To be successful in this role, you'll need to have excellent interpersonal, communication and numeracy skills."
75,London,Aston Charles,Junior/ Trainee Financial Adviser - London,"Ongoing mentoring – hands on support to ensure long-term success.
Marketing support – providing a regular, sustained flow of new clients and business…"
76,London,KennedyPearce Consulting,Finance and Accounts Assistant,"Respond to queries and issues arising in a timely and professional manner.
As a business they manage lifestyle, investment portfolio and assets of high net…"
77,London,Cedar Recruitment Limited,Finance Business Partner,The ideal candidate for the role of Finance Business Partner will be a qualified accountant (ACA / CIMA / ACCA) who has already gained significant analytical…
78,London,Marks Sattin Specialist Recruitment,Accounts Assistant,"Support the communication of queries between the firm and the Corporate Team.
This role is perfect for someone who is looking for a long term, stable role and…"
79,London,Page Personnel - UK,Graduate finance analyst,"The client is a regulatory body based in London.
Support the development, maintenance and use of financial models to best practice standards."
80,London,Aston Charles,Junior/ Trainee Financial Adviser - Reading,"Ongoing mentoring – hands on support to ensure long-term success.
Marketing support – providing a regular, sustained flow of new clients and business…"
81,London,Law Choice Recruitment,Junior Finance Administrator,Are you a recent School or College leaver with a passion or Maths? Or are you keen to get into Legal Finance? This could be the start of something special!…
82,London,Taylor Root Global Legal Recruitment,Structured finance (buy-side),"Location: London, England Sector: Banking & Financial Services Job type: Permanent Salary: Negotiable Contact: Ann Marie Martakis Contact email:…"
83,London,Media Contacts Ltd,Financial Analyst – Entry level,A high growth start-up providing business critical intelligence to banks and law firms are looking to add a Junior Analyst to their team in order to research…
84,London,Law Choice Recruitment,Finance Assistant,"If you have experience within professional services, an understanding of Billing/Accounts within Legal would also be great, and you’re looking for a role to…"
85,London,Law Choice Recruitment,Finance Services Assistant,"Ideally you will have a minimum of 6 months experience gained from a City law firm .
Working within a small team you will be working directly with the Finance…"
86,London,Law Choice Recruitment,LEGAL CASHIER/FINANCE ASSISTANT,This impressive growing law firm based close to Bank is currently looking for a Legal Cashier to join its friendly and growing Accounts team. This is a real…
87,London,Velocity Black,Finance Assistant,"Reporting to the Senior Accountant but with key relationships with the CEO and COO, this is a significantly visible role and suitable for someone who wishes to…"
88,London,LuxDeco.com,Finance Assistant,"Daily review of all sales invoices raised to ensure these have been correctly prepared by the sales teams.
Preparing regular debtor ageing reports and liaising…"
89,London,Shawpoint,M&A/Corporate Finance VP,"Candidates will benefit from a lean team with ample opportunity to focus on the mid-market for progression and client exposure.
O Term sheet and legal mark-ups."
90,London,experisuk,Finance Director,"Fully qualified accountant, ideally from a Big4 background.
This role supports the Engineering teams and is responsible for partnering with and providing all…"
91,London W1F 0UR,Tradeweb,Financial Accountant,"Recently qualified accountant/Finalist (ACA, ACCA, CIMA) , with previous relevant experience.
You will be a self-starter with excellent analytical skills."
92,London,Millennium Management,Accounts Payable Specialist,The successful candidate will have a reasonable understanding of the Procure to Pay process from working with a recognized accounting platform (Oracle Cloud…
93,Greater London,Watches2U,Finance Manager,UK based £10m+ multinational ecommerce business seeking a qualified Financial Accountant to manage all the financial and accounting activities of the business.
94,London,TikTok,Accounts Payable Specialist,"Review and approve payment requests from global vendors on a daily basis.
Review the financial terms of global contracts.
Answer employees questions on AP."
95,London,CITI,"Investment Banking, Summer Associate, London (Europe, Middle East and Africa)","In addition to traditional investment banking advising Corporate Clients in mergers & acquisitions, divestitures, financial restructurings, takeover defense,…"
96,Stockley Park,Carneys Community,Finance Officer,"; Dealing with supplier and staff queries and producing ad hoc reports as required;
; Ensuring all income and expenditure transactions are accurately recorded…"
97,Hatfield,Tate,Finance Analyst,"The ideal will be available immediate and happy to commit, have of remote working and be part Cima qualified.
This is a temporary role for approx 3-6 months."
98,London,Plum Fintech,Head of Finance & Operations,"Be able to tell the story of Plum via both growth and financial metrics how that ties back to LTV.
Be an effective communicator of future strategy of Plum."
99,East London,Shawpoint,M&A/Corporate Finance VP,"Candidates will benefit from a lean team with ample opportunity to focus on the mid-market for progression and client exposure.
O Term sheet and legal mark-ups."
100,Camden,Capital Index,Junior KYC and On-boarding Analyst,"Be available to support regular seminars offered by Partner companies and assist with account opening queries via chat, telephone and email."
101,London,Millennium Management,Accounts Payable Specialist,The successful candidate will have a reasonable understanding of the Procure to Pay process from working with a recognized accounting platform (Oracle Cloud…
102,London,TikTok,Accounts Payable Specialist,"Review and approve payment requests from global vendors on a daily basis.
Review the financial terms of global contracts.
Answer employees questions on AP."
103,London,experisuk,Finance Director,"Fully qualified accountant, ideally from a Big4 background.
This role supports the Engineering teams and is responsible for partnering with and providing all…"
104,London,Elevate Group,Senior Sales Executive – Asset backed Investment Bonds.,"Working only with qualified in-bound leads, your role will entail generating new clients through calls, emails and meetings.
1st Year OTE: £75,000 - £90,000."
105,London,Jasper Rose,Accounts Assistant,"You will take sole ownership for the purchase & sales ledger function, as well as assisting with the month-end process."
106,London,Construction and Engineering Company,Finance Director,"Develop account reconciliations, journal entries, data compilation and analyses ensuring accuracy and timely delivery.
Managing on a day-to-day basis."
107,London,G-Research,Quantitative Analyst,"We pair this expertise with machine learning, big data, and some of the most advanced technology available to predict movements in financial markets."
108,London WC1V 6NX,Amazon Online UK Limited,"Business Intelligence Analyst, Advertising Finance","Bachelor’ s degree in mathematics, statistics, operational research, economics or related discipline.
Proficiency in analytical data manipulation on large…"
109,London,Shawpoint,M&A/Corporate Finance VP,"Candidates will benefit from a lean team with ample opportunity to focus on the mid-market for progression and client exposure.
O Term sheet and legal mark-ups."
110,Charlton,Capital Index,Junior KYC and On-boarding Analyst,"Be available to support regular seminars offered by Partner companies and assist with account opening queries via chat, telephone and email."
111,London SE1 8DJ,Tradeweb,Financial Accountant,"Recently qualified accountant/Finalist (ACA, ACCA, CIMA) , with previous relevant experience.
You will be a self-starter with excellent analytical skills."
112,London E1 6JE,Millennium Management,Accounts Payable Specialist,The successful candidate will have a reasonable understanding of the Procure to Pay process from working with a recognized accounting platform (Oracle Cloud…
113,London,TikTok,Accounts Payable Specialist,"Review and approve payment requests from global vendors on a daily basis.
Review the financial terms of global contracts.
Answer employees questions on AP."
114,London,Watches2U,Finance Manager,UK based £10m+ multinational ecommerce business seeking a qualified Financial Accountant to manage all the financial and accounting activities of the business.
115,London,Amazon UK Services Ltd.,Finance Analyst,"BA/BS in Business, Finance, Economics, Engineering, Mathematics or other fields with analytical focus.
2+ years of corporate finance or related analytical…"
116,London,Cognithan Limited,Accounts Assistant,"Respond to and resolve all accounting and payroll queries and enquiries.
Work with the Accountant to prepare unit budgets, monitor and report on units financial…"
117,London,Climate Policy Initiative,Energy Finance Analyst,"Roles at CPI require well-rounded candidates with a talent for independent thinking, effective collaboration and pragmatic problem-solving skills."
118,London EC2A,Lendable,Capital Markets Analyst,Our relentless drive to automate and improve processes allows customers to apply for and receive their loan in well under 10 minutes on average (instead of days…
119,London,KennedyPearce Consulting,Finance and Accounts Assistant,"Respond to queries and issues arising in a timely and professional manner.
As a business they manage lifestyle, investment portfolio and assets of high net…"
